ID,TITLE,CLASSE
1041354,Acessório T - Jean Bag For Girls para DS Lite,não-smartphone
1041782,Carrinho de Bebê Berço-Passeio - Pegasus Pink - Galzerano,não-smartphone
1041834,Carrinho de Bebê para Gêmeos Berço-Passeio - Twin - Galzerano,não-smartphone
1042568,Car Center - Calesita,não-smartphone
1042584,Donka Trem com Som - Calesita,não-smartphone
1043696,Interfone HDL AZ-01 Branco,não-smartphone
1940486,"Smartphone LG Optimus L7 II Dual P716 Preto com Dual Chip, Tela de 4.3”, Android 4.1, Câmera 8MP, 3G, Wi-Fi, aGPS, Bluetooth e Cartão 4GB - Celular LG Optimus L7 II Dual",smartphone
2277815,"Smartphone Samsung Galaxy S4 Mini Duos Preto com Dual Chip, Tela 4.3"", Android 4.2, Câmera 8MP e Processador Dual Core de 1.7 Ghz - Claro - Galaxy S4 Mini Duos",smartphone
2961097,"Smartphone  Samsung Galaxy S5 SM-G900M Branco com Tela 5.1"", Android 4.4, 4G, Câmera 16MP e Processador Quad Core 2.5GHz",smartphone
2961099,"Smartphone  Samsung Galaxy S5 SM-G900M Dourado com Tela 5.1"", Android 4.4, 4G, Câmera 16MP e Processador Quad Core 2.5GHz",smartphone
3031744,"Smartphone LG L90 Dual D410 Preto com Tela de 4.7”, Dual Chip, Android 4.4, Câmera 8MP e Processador Quad Core de 1.2 GHz",smartphone
3076120,"Smartphone  Samsung Galaxy Core Plus Branco com Tela 4.3"", TV Digital, Dual Chip, Android 4.3, Processador Dual Core 1.2 Ghz e Câmera de 5MP",smartphone
3507499,"Smartphone Samsung Galaxy Pocket 2 Duos SM-G110B Branco com Dual Chip, Android 4.4, Wi-Fi, 3G, GPS, Câmera 2MP, FM, MP3 e Bluetooth",smartphone
3507899,"Smartphone  Samsung Galaxy S5 Duos SM-G900 Preto com Dual Chip,Tela 5.1"", Android 4.4, 4G, Câmera 16MP e Processador Quad Core 2.5GHz",smartphone
3580503,"Smartphone Samsung Galaxy Ace 4 Lite Duos G313M Preto com Tela de 4”, Dual Chip, Android 4.4, Câmera 3MP, 3G, WiFi e Processador de 1GHz",smartphone
3608270,"Smartphone LG G2 Lite D295 Branco com Tela de 4.5”, Dual Chip, Android 4.4, Câmera 8MP, 3G e Processador Quad Core de 1.2GHz",smartphone
3638254,"Smartphone Samsung Galaxy Young 2 Duos G130M Branco com Tela 3.5"", Dual Chip, Android 4.4, 3G, Wi-Fi, GPS, Rádio FM e Câmera de 3MP.",smartphone
3638255,"Smartphone Samsung Galaxy Young 2 Duos G130M Cinza com Tela 3.5"", Dual Chip, Android 4.4, 3G, Wi-Fi, GPS, Rádio FM e Câmera de 3MP.",smartphone
3842557,"Smartphone Alcatel One Touch Pop C7 Branco com Tela 5”, Dual Chip, Câmera 8MP, Android 4.2, 3G e Processador Quad Core de 1.3 Ghz - Vivo",smartphone
4174797,"Smartphone Samsung Galaxy Win 2 Duos TV Branco com Dual Chip, Tela de 4.5"", TV Digital, Android 4.4, Câm. de 5MP e Processador Quad Core de1.2 Ghz",smartphone
4174800,"Smartphone Samsung Galaxy Ace 4 Duos G313M/DS Cinza com Tela de 4”, Dual Chip, Android 4.4, Câmera 5MP, 3G e Processador Dual Core de 1GHz",smartphone
4186072,"Smartphone Samsung Galaxy A7 4G Duos SM-A700FD Branco com Dual Chip, Tela 5.5"", 4G, Android 4.4, Câmera 13MP e Processador Octa Core",smartphone
4188382,"Smartphone Samsung Galaxy Ace 4 Duos G313M/DS Branco com Tela de 4”, Dual Chip, Android 4.4, Câmera 5MP, 3G e Processador Dual Core de 1GHz",smartphone
4333921,"Smartphone Samsung Galaxy E5 4G Duos E500M/DS Branco com Dual Chip, Tela 5"" HD sAMOLED, Android 4.4, Câmera 8MP e Processador Quad Core 1.2GHz",smartphone
4382821,"Smartphone Samsung Galaxy A5 4G Duos A500M/DS Dourado com Dual Chip, Tela 5"", Android 4.4, Câm.13MP e Processador Quad Core 1.2GHz",smartphone
4457760,"Smartphone Desbloqueado Samsung Galaxy S6 Edge SM-G925I Verde com 64GB, Tela de 5.1"", Android 5.0, 4G, Câmera 16 MP e Processador Octa Core",smartphone
4457762,"Smartphone Samsung Galaxy S6 Edge SM-G925I Preto com 64GB, Tela de 5.1"", Android 5.0, 4G, Câmera 16 MP e Processador Octa Core",smartphone
4457764,"Smartphone Samsung Galaxy S6 Edge SM-G925I Branco com 64GB, Tela de 5.1"", Android 5.0, 4G, Câmera 16 MP e Processador Octa Core",smartphone
4626851,"Smartphone Microsoft Lumia 640XL Dual Preto com Windows Phone 8.1, Tela de 5.7"", Dual Chip, 3G, Câmera 13MP e Processador Quad Core de 1.2 GHz",smartphone
5409352,"Smartphone Samsung Galaxy Win 2 Duos TV G360BT Cinza com Dual Chip, Tela de 4.5"", TV Digital, Android 4.4, Câm. de 5MP e Processador Quad Core 1.2 GHz",smartphone
5409353,"Smartphone Samsung Galaxy Win 2 Duos TV G360BT Branco com Dual Chip, Tela de 4.5"", TV Digital, Android 4.4, Câm. de 5MP e Processador Quad Core 1.2GHz",smartphone
6034913,"Smartphone Positivo Quattro X435 Preto com Dual Chip, Tela 5”, Android 5.1, Câmera 5MP, 4G, Wi-Fi, Bluetooth e Processador Quad Core 1.0GHz",smartphone
7259387,"Smartphone LG K4 Indigo com 8GB, Dual Chip, Tela de 4.5"", 4G, Android 5.1, Câmera 5MP e Processador Quad Core de 1GHz",smartphone
7259389,"Smartphone LG K10 TV Índigo com 16GB, Dual Chip, Tela de 5.3"" HD, 4G, Android 6.0, Câmera 13MP e Processador Octa Core de 1.14 GHz",smartphone
7528302,"Smartphone Multilaser MS50 Colors Preto com Tela 5.0”, Dual Chip, Android 5.0, Câmera 8MP, Wi-Fi, 3G, Bluetooth e Processador Quad Core de 1.3 GHz",smartphone
7528303,"Smartphone Multilaser MS50 Colors Branco com Tela 5.0”, Dual Chip, Android 5.0, Câmera 8MP, Wi-Fi, 3G, Bluetooth e Processador Quad Core de 1.3 GHz",smartphone
7528304,"Smartphone Multilaser MS50 Senior Preto com Tela 5.0”, Dual Chip, Android 5.0, Câmera 8MP, Wi-Fi, 3G, Bluetooth e Processador Quad Core de 1.3 GHz",smartphone
7923488,Smartphone ASUS Zenfone II ZE551 16GB 4G Tela 5.5 ZE551ML-6C705WW - BVOLT,smartphone
8105618,"Smartphone Asus Zenfone 2 ZE551ML, 4G Android 5.0 Intel Quad Core 2.3GHz 16GB Câmera 13MP Tela 5.5, Dourado",smartphone
10025085,Moroccanoil Brilho Reflexivo Glimmer Shine 100 ml,não-smartphone
10025985,Telefone de Mesa Estilo Roda Azul c/ Luz - AR5063,não-smartphone
10026064,Maquina Para Corte E Acabamento De Pelo / Cabelo Wahl Detailer 5 Star Series Bivolt,não-smartphone
10026491,Kit 4 Tinta Epson Universal High Definition Aton Cmyk 1 Litro,não-smartphone
10026591,Caminhão Super Bombeiro Resgate Som E Luz - Magic Toys,não-smartphone
10027375,Acordeon Sanfona 48 Baixos Michael Acm4803 C/ Bag E Hardcase,não-smartphone
10027491,"Capa Folio Universal Rotativa 4"" Preta - Muvit",não-smartphone
10027515,Capa Iphone 6 Plus - Muvit,não-smartphone
10027542,Transformers 4 Power Battlers Dinobot Strafe - Hasbro,não-smartphone
10028171,Lixeira Basculante Grande 60 Litros Sanremo,não-smartphone
10029373,Violão Infantil Acústico Nylon Michael Vm10e Bk 1/4 Preto,não-smartphone
10029788,Marvel-Estojo Xeryus 4535,não-smartphone
10029794,Playground Modular Advanced - Xalingo,não-smartphone
10029797,Violão Jumbo Elétrico Michael Vm625dt Venetian Com Bag,não-smartphone
10029798,Violão Elétrico Michael Vm921 Folk Aço Natural Fosco C/Bag,não-smartphone
10029821,Cars-Rádio Controle Mater Tokyo Drift Yellow 2413,não-smartphone
10029845,Violão Elétrico Michael Venetian Vm625dtst Aço - Natural Satin,não-smartphone
10029931,Kit Babete Feminina com 3 Unidades Bordada Chocalho,não-smartphone
10049750,Colchão Solteiro De Espuma Ortobom Viscomemory 88x188x32,não-smartphone
10057726,Tinta Para Cartucho Hp 935xl Cyan Pigmentada 1 Litro Aton High Definition,não-smartphone
10074259,Pelicula De Vidro Temperado Para Celular Lg G2 Lite D295,não-smartphone
10074262,Pelicula De Vidro Temperado Para Samsung Galaxy E7 E700,não-smartphone
10074327,Pelicula de Vidro Temperado para Asus Zenfone 6,não-smartphone
10076032,Tinta Para Cartucho Hp E3e03a | 935xl Cyan Pigmentada 100ml,não-smartphone
10078038,Playground Modular Adventure - Xalingo,não-smartphone
10080076,Playground Modular Future - Xalingo,não-smartphone
10080645,Pigmento Dailus Color Pro 06,não-smartphone
10080655,Pigmento Dailus Color Pro - 04,não-smartphone
10106758,Kit com 6 Porta-copos Bola 1,não-smartphone
10111398,Memoria 4gb Ddr3 1333 Kvr13n9s8/4 Kingston,não-smartphone
10111460,Tinta Para Cartucho Hp 935xl Cyan Pigmentada 500ml Aton High Definition,não-smartphone
10111474,Tinta Para Cartucho Hp 935xl Magenta Pigmentada 100ml Aton High Definition,não-smartphone
10111480,Tinta Para Cartucho Hp 934xl Black Pigmentada 500ml Aton High Definition,não-smartphone
10119246,Headphone Sense Oex Hp-100 Preto,não-smartphone
10146854,Estojo Nintendo Ds Mini Folio Pink Ds Nin,não-smartphone
10156714,Colar Masculino Couro Zíper E Caveira Preto,não-smartphone
10156720,Pulseira Masculina Feminina Lava Vulcância Crucifixo,não-smartphone
10156960,Kit Pulseira Masculina Feminina Couro E Crucifixo,não-smartphone
10157001,Cinta Slackline Azul 15 metros,não-smartphone
10157055,Pulseira Masculina De Couro E Placa Faithfé,não-smartphone
10157059,Kit Pulseira Masculina Couro E Tubo Açaí,não-smartphone
10157104,Pulseira Masculina Feminina Couro Marrom Infinito Vintage,não-smartphone
10157109,Pulseira Masculina Crucifixo E Ônix,não-smartphone
10157129,Pulseira Masculina Pedra Ônix Olho Tigre,não-smartphone
10157130,Pulseira Masculina Couro E Crucifixo Envelhecido,não-smartphone
10157158,Kit Pulseiras Masculinas Femininas Couro E Olho Grego,não-smartphone
10157160,Pulseira Masculina Pedra Ônix E Turquesa,não-smartphone
10157164,Pulseira Masculina Feminina Pedra Ônix E Olho De Tigre,não-smartphone
10157261,Pulseira Masculina Couro E Simbolo Infinito Ouro Velho,não-smartphone
10157269,Pulseira Masculina Pedra Natural Jaspe,não-smartphone
10157481,Kit Pulseiras Masculinas Femininas Turquesa Açaí E Cristais,não-smartphone
10157538,Pulseiras Masculinas Couro E Crucifixo,não-smartphone
10157548,Pulseira Masculina Feminina Pedra Ônix E Turquesa,não-smartphone
10157589,Pulseira Masculina Shambala Olho De Tigre E Metais,não-smartphone
10157599,Pulseira Masculina Shambala Ancôra,não-smartphone
10157627,Kit Pulseiras Masculinas De Couro Anzol E Metal,não-smartphone
10158095,Colar Masculino Em Couro Pingentes Preto,não-smartphone
10168060,Capa  Película Vidro Iphone 5 / 5s Silicone Tpu Premium - Husky - Fumê,não-smartphone
10169722,Bumper Ero Original Samsung Galaxy S3 Siii I9300 + Pingente Laço (Bd11),não-smartphone
10170169,Bumper Ero Original Galaxy S3 Siii I9300 + Pingente Laço (Bd06),não-smartphone
10170351,Bumper + Case Ero Iphone 4 /4s Original Premium + Película (Bd05),não-smartphone
10170805,Bumper Ero Original Galaxy S3 Siii I9300 + Pingente Laço (Bd01),não-smartphone
10171144,Bastão Retrátil em Polímero,não-smartphone
10171191,Calça Feminina Camuflada Estonada Woodland Black,não-smartphone
10171277,Churrasqueira Rotativa Vertical à Gás Amarela 1055 - Malta,não-smartphone
10172173,Coldre Com Protetor De Coxa E Adaptador De Cintura - Canhoto,não-smartphone
10172236,Bumper + Case Ero Iphone 4 /4s Original Premium + Película (Bd06),não-smartphone
10172238,Bumper Ero Original Samsung Galaxy S3 Siii I9300 + Pingente Laço (Bd13),não-smartphone
10172241,Bumper Ero Original Samsung Galaxy S3 Siii I9300 + Pingente Laço (Bd12),não-smartphone
10172251,Bumper Ero Original Samsung Galaxy S3 Siii I9300 + Pingente Laço (Bd10),não-smartphone
10172255,Bumper Ero Original Galaxy S3 Siii I9300 + Pingente Laço (Bd08),não-smartphone
10172262,Bumper Ero Original Galaxy S3 Siii I9300 + Pingente Laço (Bd05),não-smartphone
10172264,Bumper Ero Original Galaxy S3 Siii I9300 + Pingente Laço (Bd07),não-smartphone
10172273,Bumper Ero Original Galaxy S3 Siii I9300 + Pingente Laço (Bd04),não-smartphone
10172275,Bumper Ero Original Galaxy S3 Siii I9300 + Pingente Laço (Bd03),não-smartphone
10172279,Bumper Ero Original Galaxy S3 Siii I9300 + Pingente Laço (Bd02),não-smartphone
10174174,Capacete Agv Blade Celebr-8 Black,não-smartphone
10174707,Película Vidro Temperado Lg G4 / Dual Proteção Máxima Invisível Alta Definição - Husky,não-smartphone
10175114,Capa  Película Vidro Lg G4 / Dual Silicone Tpu Premium - Husky - Fumê,não-smartphone
10175869,Película Vidro Temperado Moto Maxx Proteção Máxima Invisível Alta Definição - Husky,não-smartphone
10176703,Forno Micro Ondas Panasonic Nn-St674s Inox 32l,não-smartphone
10178736,Capa Lg G4 / Dual Silicone Tpu Premium - Husky - Fumê,não-smartphone
10188031,Seladora Manual Térmica Com Pedal 25cm Para Embalagens 166 - Malta,não-smartphone
10193770,Película Vidro Temperado Sony Xperia Z3 Compact Proteção Máxima Invisível Alta Definição - Husky,não-smartphone
10195070,Kit 4 Tintas A Cartucho Hp 940 Cmyk Aton 100ml,não-smartphone
10198749,Tinta Para Cartucho Hp 22 28 57 Cyan 500ml Corante,não-smartphone
10198750,Tinta Para Cartucho Hp 22 28 57 Yellow 500ml Corante,não-smartphone
10198759,Kit 4 Tintas Cmyk Para Cartucho Hp 21 | 22 1 Litro,não-smartphone
10198837,Tinta Para Cartucho Hp 22 28 57 Magenta 500ml Corante,não-smartphone
10198872,Kit 4 Tintas Cmyk 500ml Para Cartucho Hp 21 | 22,não-smartphone
10198879,Tinta Para Cartucho Hp 21 27 56 Black 1 Litro Pigmentada,não-smartphone
10198882,Tinta Para Cartucho Hp 22 28 57 1 Litro Corante Magenta,não-smartphone
10198974,Tinta Para Cartucho Hp 940 Magenta Aton 100ml Corante,não-smartphone
10198981,Tinta Para Cartucho Hp 22 28 57 1 Litro Corante Cyan,não-smartphone
10199588,Churrasqueira Rotativa Vertical À Gás Vermelha 1054 - Malta,não-smartphone
10200151,Kit 6 Tinta L800 Para Epson Bulk Ink Aton Cmyk 1 Litro,não-smartphone
10200263,Tinta Para Cartucho Canon Pg210 | Mp495 Black Pigmentada 1 Litro,não-smartphone
10200264,Tinta Para Cartucho Canon Cl211 | Mp495 Yellow Corante 1 Litro,não-smartphone
10200268,Tinta Para Cartucho Canon Cl211 | Mp495 Cyan Corante 1 Litro,não-smartphone
10200288,Tinta Para Cartucho Canon Cl211 | Mp495 Cyan Corante 500ml,não-smartphone
10200290,Tinta Para Cartucho Canon Cl211 | Mp495 Magenta Corante 500ml,não-smartphone
10200292,Tinta Para Cartucho Canon Cl211 | Mp495 Cyan Corante 100ml,não-smartphone
10200300,Tinta Para Cartucho Canon Pg210 | Mp495 Black Pigmentada 100ml,não-smartphone
10200306,Tinta Para Cartucho Canon Cl211 | Mp495 Magenta Corante 1 Litro,não-smartphone
10200335,Tinta Para Cartucho Canon Pg210 | Mp495 Black Pigmentada 500ml,não-smartphone
10200346,Tinta Para Cartucho Canon Cl211 | Mp495 Yellow Corante 500ml,não-smartphone
10200449,Tinta Para Cartucho Canon Cl211 | Mp495 Magenta Corante 100ml,não-smartphone
10200778,Capa Para Samsung S4 I9500 Homer Simpson Beer Now Com Película Protetora,não-smartphone
10200842,Coqueteleira Blender Com Mola 600 Ml - Atlhetica,não-smartphone
10200929,"Capa para Celular Samsung S View Cover Galaxy S4 Mini, Branca",não-smartphone
10201171,Anabolizante Capilar 1kg Forever Liss,não-smartphone
10201863,Capacete Peels Spike Ladybug,não-smartphone
10202297,Protetores Premium Iphone 4/4s Coloridos Dgipod1578 Isound,não-smartphone
10202888,Bumper Para Iphone 5/5s Com Botões Cromados (Branco/Transparente),não-smartphone
10202890,Bumper Para Iphone 5/5s Com Botões Cromados (Azul),não-smartphone
10202891,Bumper Para Iphone 5/5s Com Botões Cromados (Branco),não-smartphone
10203071,Bota Masculina Mondeo Urban City Couro Preta,não-smartphone
10203446,Película Protetora Ipod 30 E 60 Gb 2 Unid 18288 I-Concepts,não-smartphone
10205638,Coldre Com Protetor De Coxa E Adaptador De Cintura - Destro,não-smartphone
10206264,Tablet Multilaser M7s Quad Core Wi fi 7 Preto Nb184,não-smartphone
10206380,Buggy Com Jet Ski E Boneca - Monte Líbano,não-smartphone
10214290,Bumper  Case Kate Spade Premium Ny Iphone 4/4s  Pingente (Bd01),não-smartphone
10214291,Bumper  Case Kate Spade Premium Ny Iphone 4/4s  Pingente (Bd03),não-smartphone
10214293,Bumper  Case Kate Spade Premium Ny Iphone 4/4s  Pingente (Bd04),não-smartphone
10214294,Bumper  Case Kate Spade Premium Ny Iphone 4/4s  Pingente (Bd06),não-smartphone
10214297,Bumper  Case Kate Spade Premium Ny Iphone 5/5s (Bd 09),não-smartphone
10214303,Bumper  Case Kate Spade Premium Ny Iphone 4/4s  Pingente (Bd02),não-smartphone
10214304,Bumper  Case Kate Spade Premium Ny Iphone 4/4s  Pingente (Bd05),não-smartphone
10214324,Bumper  Case Kate Spade Premium Ny Iphone 5/5s (Bd 01),não-smartphone
10215527,Bumper Face Mirror Series Iphone 4 E 4s / Película (Bd02),não-smartphone
10215529,Capa Flip Cover Galaxy Grand Duos I9080/I9082 (Preto),não-smartphone
10215531,Bumper Face Mirror Series Iphone 4 E 4s / Película (Bd03),não-smartphone
10215534,Bumper / Case Iphone 4/4s Iface  Revolution  / Película (Cinza),não-smartphone
10215535,Bumper Face Mirror Series Iphone 4 E 4s / Película (Bd05),não-smartphone
10215539,Bumper Face Mirror Series Iphone 4 E 4s / Película (Bd08),não-smartphone
10215541,Bumper / Case Iphone 4/4s Iface  Revolution  / Película (Pink),não-smartphone
10215544,Bumper / Case Iphone 4/4s Iface  Revolution  / Película (Roxo),não-smartphone
10215545,Capa Flip Cover Galaxy Grand Duos I9080/I9082 (Chumbo),não-smartphone
10215551,Bumper Face Mirror Series Iphone 4 E 4s / Película (Bd04),não-smartphone
10215553,Bumper Face Mirror Series Iphone 4 E 4s / Película (Bd06),não-smartphone
10215555,Bumper / Case Iphone 4/4s Iface  Revolution  / Película (Branco),não-smartphone
10215557,Bumper / Case Iphone 4/4s Iface  Revolution  / Película (Azul),não-smartphone
10215563,Capa Flip Cover Galaxy Grand Duos I9080/I9082 (Branco),não-smartphone
10215565,Bumper / Case Iphone 4/4s Iface  Revolution  / Película (Rosa),não-smartphone
10215567,Capa Flip Cover Galaxy Grand Duos I9080/I9082 (Rosa),não-smartphone
10215568,Bumper Face Mirror Series Iphone 4 E 4s / Película (Bd01),não-smartphone
10220560,Boneco Minion Stuart Fart Dart Launcher - Toyng,não-smartphone
10223260,Bumper  Case Flip Cover Fashion Iphone 5/5s (Bd04),não-smartphone
10224777,Capa Bag Case Para Piano Digital Casio Privia Px5s Sc700p,não-smartphone
10226488,Fonte Atx Cx430 Corsair 1v V.3 430w Real 80 Plus Bronze,não-smartphone
10226623,Suporte Veicular 360°Universal Smartphones/Celulares/Gps4.3,não-smartphone
10226677,Bobina Em Papel Térmico Krp 80mm X 40m Caixa Com 30 Rolos Silfer,não-smartphone
10227145,Kit 4 Tintas Cmyk Para Cartucho Hp 21 22 100ml,não-smartphone
10227395,Capa Case Para Ipad Air 2 Apple Giratória 360º / Caneta Touch (Rosa),não-smartphone
10227738,Gabinete Gamer Strike X Advance En58032 Vermelho Aerocool,não-smartphone
10228191,Kit 2 Vias 6 Bomber Upgrade - 120 Watts Rms,não-smartphone
10228654,Rastilho Plastico P/Violao - Izzo,não-smartphone
10228673,Regua Caixa Rack 19´´ 8 Tomadas Traseiras Ac 2pt Nbr 2707n Projeta,não-smartphone
10229005,Cabo De Força Bipolar Para Fonte De Impressora 1.5m,não-smartphone
10229064,"Baterial Recarregavel 300mah 3,6v Aaa Ni-Mh Flex",não-smartphone
10229098,Kit Telefone Celular Fixo Prokd-6000 Preto Proeletronic,não-smartphone
10229104,Bateria Para Telefone Rural Ca40/Ca42/Ca403g 053048a Aquario,não-smartphone
10229203,Memória Kingston Hyperx Savage 4gb 1600mhz Ddr3 Cl9 Vermelha Hx316c9sr/4,não-smartphone
10229265,Película Para Sony Xperia P - Diamant,não-smartphone
10229279,Memória 4gb Ddr3 Kingston Hyperx Fury 1600mhz Vermelho (Hx316c10fr/4),não-smartphone
10229375,"Tablet Samsung Galaxy Tab A 4g Sm-P355m,8,16gb,Câmera 5mp, Android 5.0,Quad Core 1.2 Ghz  Branco",não-smartphone
10229598,Guardanapo De Papel Folha Simples Azul Claro 30 X 33cm Pacote Com 50 Unidades Dafesta,não-smartphone
10230429,Camiseta Decote V Plus Size,não-smartphone
10230494,Memória 8Gb (1X8gb) Ddr3 1866Mhz Hyperx Fury Black Hx318c10fb/8 Kingston,não-smartphone
10231173,Memoria Kingston HYPER X FURY RED DESK 8GB DDR3 1866 HX318C10FR/8,não-smartphone
10231219,Memoria Desktop Gamer Hyperx Ddr3 Fury 8gb 1600mhz Ddr3 Non-Ecc Cl10 240-Pin Udimm Blue - Kingston,não-smartphone
10231221,Memoria Desktop Gamer Hyperx Ddr3 Fury 8gb 1600mhz Ddr3 Non-Ecc Cl10 Udimm Black - Kingston,não-smartphone
10231251,Memoria Desktop Gamer Hyperx Ddr3 Fury 4gb 1866mhz - Kingston,não-smartphone
10231284,"Linha YGK Nitlon DFC Fluorocarbon (0,32mm - 14lb) 100m",não-smartphone
10231290,Memoria Desktop Gamer Hyperx Ddr3 Fury 4gb 1600mhz Ddr3 Non-Ecc Cl10 240-Pin Udimm Red - Kingston,não-smartphone
10232662,"Linha Ygk G-Soul Super Jigman X4 2.5 (0,26mm - 35lb) 300m",não-smartphone
10236905,Capacete Ls2 Ff358 Réplica Alex Barros,não-smartphone
10252444,Omnitrix Touch Omniverse Nova Versão - Sunny 654,não-smartphone
10255571,Tartarugas Ninja - Splat Flyer - Dtc,não-smartphone
10257994,Xploderz Munição - Sunny 401,não-smartphone
10260741,Guardanapo De Papel Rosa Com Bolinha Branca Dafesta,não-smartphone
10270678,Relógio De Ponto Cartografico,não-smartphone
10272343,Colar Masculino Couro Pingentes Crucifixo E Nossa Senhora Aparecida Preto,não-smartphone
10287158,Cortina Tipo Tenda Castelo Lilás Para Cama Alta Com Armário ? Casatema,não-smartphone
10298119,Bumper Face Mirror Series Iphone 4 E 4s / Película (Bd07),não-smartphone
10337346,Wella Professionals Enrich - Máscara Hidratante Cabelo Normal a Fino 500ml,não-smartphone
10338992,Coifa de Parede Esmeralda 90 Cm Inox - Suggar,não-smartphone
10344521,Balcão de pia com 2 portas e 3 gavetas Bella - Acabamento em Melamínico - MDP - Branco/ Rústico,não-smartphone
10355779,Carro Roller Baby Versati Mex Elt Azul Magic Toys 1034,não-smartphone
10355794,Capa Flip Cover Galaxy Grand Duos I9080/I9082 (Verde),não-smartphone
10361123,Tinta Para Cartucho Hp 22 28 57 Yellow 100ml Corante Aton,não-smartphone
10361282,Kit 4 Tintas Cmyk Aton Para Cartucho Hp 21 22 500ml,não-smartphone
10361924,Kit 4 Tintas Cmyk Para Cartucho Hp 74 75 Aton 1 Litro,não-smartphone
10362052,Tinta Para Cartucho Lexmark 26 Cyan Corante 1 Litro,não-smartphone
10362157,Bicama Solteiro Empilhável ou Casal Madeira Maciça - Laqueado Branco - Casatema,não-smartphone
10362166,Cama Solteiro Empilhável Madeira Maciça - Laqueado Branco - CasaTema,não-smartphone
10363102,Carteira Travel Wallet Sea To Summit Roxo G,não-smartphone
10365719,"Cabo Hdmi X Dvi 1.8 Metros Hdmi 1.4 10,2 Gbps",não-smartphone
10365733,Caixa De Papelão Para Pipoca Amarela Com 8 Unidades Dafesta,não-smartphone
10365825,Caixa De Papelão Para Pipoca Branca Com Bolinha Azul Com 8 Unidades Dafesta,não-smartphone
10365978,Caixa De Papelão Para Pipoca Branca Com Bolinha Rosa Com 8 Unidades Dafesta,não-smartphone
10366581,Guardanapo De Papel Lilás Com Bolinha Branca Dafesta,não-smartphone
10366600,Guardanapo De Papel Marrom Com Bolinha Azul Dafesta,não-smartphone
10366654,Guardanapo De Papel Folha Simples Rosa Claro 30 X 33cm Pacote Com 50 Unidades Dafesta,não-smartphone
10366662,Guardanapo De Papel Azul Escuro Folha Simples 30 X 33cm Pacote Com 50 Unidades Dafesta,não-smartphone
10366697,Estêncil Para Pintura Simples 14x14 Selo Paris - Opa1742 - Opa,não-smartphone
10366736,Guardanapo De Papel Folha Simples Vermelho 30 X 33cm Pacote Com 50 Unidades Dafesta,não-smartphone
10366842,Caixa De Papelão Para Pipoca Branca Com Bolinha Vermelha Com 8 Unidades Dafesta,não-smartphone
10366893,Guardanapo De Papel Marrom Com Bolinha Rosa Dafesta,não-smartphone
10366941,Roland Td-1k Bateria,não-smartphone
10366959,Guardanapo De Papel Folha Simples Amarelo 30 X 33cm Pacote Com 50 Unidades Dafesta,não-smartphone
10367016,Caixa De Papelão Para Pipoca Rosa Com 8 Unidades Dafesta,não-smartphone
10367225,Caixa De Papelão Para Pipoca Lilás Com 8 Unidades Dafesta,não-smartphone
10367244,Caixa De Papelão Para Pipoca Rosa Com Bolinha Marrom Com 8 Unidades Dafesta,não-smartphone
10367365,Guardanapo De Papel Folha Simples Verde Bandeira 30 X 33cm Pacote Com 50 Unidades Dafesta,não-smartphone
10369391,Estêncil Para Pintura Simples 20x25 Flor De Lotus - Opa1775 - Opa,não-smartphone
10369397,Estêncil Para Pintura Simples 20x25 Gaiola - Opa1777 - Opa,não-smartphone
10370098,Capa Case Para Samsung Galaxy S4 Minigel Rosa Muski0146 Muvit,não-smartphone
10370525,Estêncil Para Pintura Simples 10x10 Alho - Opa1706 - Opa,não-smartphone
10370542,Estêncil Para Pintura Simples 10x10 Pimentão - Opa1716 - Opa,não-smartphone
10370544,Estêncil Para Pintura Simples 10x10 Manche - Opa1714 - Opa,não-smartphone
10370548,Estêncil Para Pintura Simples 10x10 Mandala Arabesco - Opa1715 - Opa,não-smartphone
10370549,Estêncil Para Pintura Simples 10x10 Ladrilho Flor - Opa1712 - Opa,não-smartphone
10370558,Cabo Usb Retrátil  3 Adaptadores Preto - Muvit,não-smartphone
10370563,Estêncil Para Pintura Simples 10x30 Gaveta Colonial - Opa1721 - Opa,não-smartphone
10370570,Estêncil Para Pintura Simples 10x30 Flores Tulipa Ii - Opa1720 - Opa,não-smartphone
10370587,Estêncil Para Pintura Simples 15x20 Brinco De Princesa - Opa1750 - Opa,não-smartphone
10370588,"Par Alto Falante 6x9"" Bravox B4x69 P - 160w Rms O Par - 4 Ohms",não-smartphone
10370606,Estêncil Para Pintura Simples 10x30 Íris - Opa1725 - Opa,não-smartphone
10370609,Estêncil Para Pintura Simples 15x20 Coffee - Opa1753- Opa,não-smartphone
10370610,Estêncil Para Pintura Simples 10x30 Zíper - Opa1729 - Opa,não-smartphone
10370615,Estêncil Para Pintura Simples 15x20 Bandeirinha - Opa1749 - Opa,não-smartphone
10370618,Estêncil Para Pintura Simples 15x20 Com Amor - Opa1754 - Opa,não-smartphone
10370623,Estêncil Para Pintura Simples 10x30 Margaridas - Opa1727 - Opa,não-smartphone
10370626,Estêncil Para Pintura Simples 15x20 Estamparia 4 Pontas - Opa1755 - Opa,não-smartphone
10370638,Estêncil Para Pintura Simples 10x30 Gaveta Colonial Ii - Opa1722 - Opa,não-smartphone
10370833,Memory Foam Playthru (Estojo Para Nds Preto) Lat,não-smartphone
10370901,Estêncil Para Pintura Simples 15x20 Estamparia Retrô - Opa1757 - Opa,não-smartphone
10370902,Estêncil Para Pintura Simples 20x25 Frase De Motivação - Opa1776 - Opa,não-smartphone
10371043,Kit Violão Strinberg Folk Sd20 Elétrico Com Afinador + Capa + Acessórios - Preto,não-smartphone
10376300,"Chicote Leader Marine Sports 12 (30,4cm - 30pçs)",não-smartphone
10379196,Whey 900gr - Brn Foods (val. abr/16),não-smartphone
10379436,Cd Emicida - O Glorioso Retorno De Quem Nunca Esteve Aqui - 2013,não-smartphone
