ID,TITLE,CLASSE
10471631,Lowell Bioplastia Capilar Shampoo Reconstrutor 240ml,não-smartphone
10471644,Capa Preta Para Sony Xperia Z4,não-smartphone
10471702,Capa Preta Para Sony Xperia Z3,não-smartphone
10471711,Probelle Shampoo Force Relax - 1000ml,não-smartphone
10471786,Preta Gil Esmalte Cremoso Cinza Luxo 9ml,não-smartphone
10471849,Coifa Consul Parede Facilite Piramidal Aço Inox 60cm 110V CA060BRANA,não-smartphone
10471854,Coifa Consul Parede Facilite Piramidal Aço Inox 60cm 220V,não-smartphone
10472641,Mesa Escolar Infantil 92361000 Tramontina,não-smartphone
10474045,Suporte Veicular Volante Celular Carro Gps Smartphone Iphone   Preto/Vermelho  Preto/Vermelho  Preto/Vermelho  Preto/Vermelho  Único  Único  Único  Único,não-smartphone
10474951,Orofluido Shampoo - 1000ml,não-smartphone
10475511,Pó Compacto Revlon Colorstay,não-smartphone
10475637,Bcaa Powder (300g) - Body Action,não-smartphone
10476412,Tamborete Do Bob Zoom,não-smartphone
10476834,Cintadora De Cédulas Bp 1510 (Para Fita De 3 Cm),não-smartphone
10477457,Corretivo Soft Claríssimo 00 - Dailus,não-smartphone
10477472,Schwarkopf 3d Men Shampoo Anti-Oleosidade -  250ml,não-smartphone
10477826,Base Soft Dailus - Bege Claro,não-smartphone
10478217,Dailus Base Líquida Soft Efeito Matte 30g,não-smartphone
10478219,Dailus Color - Base Liquida Soft 30g,não-smartphone
10479907,Capa Personalizada Exclusiva Nokia Lumia 830 N830 - Fl14,não-smartphone
10480045,Capa Personalizada Exclusiva Samsung Galaxy Note 4 N910c - At22,não-smartphone
10480067,Capa Personalizada Exclusiva Samsung Galaxy Note 4 N910c - Cd18,não-smartphone
10480164,Capa Personalizada Exclusiva Samsung Galaxy Note 4 N910c - Ep20,não-smartphone
10480193,Capa Personalizada Exclusiva Samsung Galaxy Note 4 N910c - Vt16,não-smartphone
10480244,Capa Personalizada Exclusiva Samsung Galaxy Note 4 N910c - Tx56,não-smartphone
10480256,Capa Personalizada Exclusiva Samsung Galaxy Note 4 N910c - Lv21,não-smartphone
10480260,Capa Personalizada Exclusiva Samsung Galaxy Note 4 N910c - Mu01,não-smartphone
10480262,Capa Personalizada Exclusiva Samsung Galaxy Note 4 N910c - Mu11,não-smartphone
10480272,Capa Personalizada Exclusiva Samsung Galaxy Note 4 N910c - Pe28,não-smartphone
10480286,Capa Personalizada Exclusiva Samsung Galaxy Note 4 N910c - Tx55,não-smartphone
10480342,Capa Personalizada Exclusiva Samsung Galaxy Note 4 N910c - Fl14,não-smartphone
10480402,Capa Personalizada Exclusiva Samsung Galaxy Note 4 N910c - Tx08,não-smartphone
10481255,"Controlador Trackformer Xw-pd1 Sintetizador, Sequenciador, Sampler E Efeitos - Casio",não-smartphone
10482026,Capa De Silicone Fumê Para Motorola Moto E 2° Geração,não-smartphone
10482286,Dominó Animais Domésticos - Ciabrink,não-smartphone
10482309,Dominó Tradicional - Ciabrink,não-smartphone
10482316,Cubo de Atividades - Ciabrink,não-smartphone
10482324,Jogo de Dominó Horas Caixa em Madeira,não-smartphone
10482333,Alfabeto Recortado - Ciabrink,não-smartphone
10482339,Alinhavos - Ciabrink,não-smartphone
10482375,Alfabeto Ilustrado - Ciabrink,não-smartphone
10482393,Fonte De Alimentação 12v 1000ma 100/240v Rohs 9124,não-smartphone
10482419,Palavras Cruzadas Pedagógicas - Ciabrink,não-smartphone
10482422,Teatro De Fantochestecidociabrink,não-smartphone
10482432,Cantinho da Leitura - Ciabrink,não-smartphone
10482436,Prateleira Infantil - Ciabrink,não-smartphone
10482438,Jogo Da Memória - Masculino E Feminino - Ciabrink,não-smartphone
10482443,Jogo Da Memória - Alfabetização - Ciabrink,não-smartphone
10482450,Material Dourado - Ciabrink,não-smartphone
10482458,Numerais com Pinos - Madeira - 55 peças,não-smartphone
10482473,Alinhavos Fundo do Mar 3D - Ciabrink,não-smartphone
10482475,Vagões Espilháveis - Madeira - Ciabrink,não-smartphone
10482490,Fantoche Reciclagem 4 Peças Em Feltro Aprendizado 1479 Ciabrink,não-smartphone
10482501,Kit Trânsito - Ciabrink,não-smartphone
10482511,Numerais e Quantidades - Ciabrink,não-smartphone
10482515,Ábaco Aberto - Sêquencia de Unidades - Ciabrink,não-smartphone
10482573,Conversor Rca/Filtro/Saida Remota St6100 Stetsom,não-smartphone
10482895,Smoby-Carrinho De Puxar Gulliver 5031,não-smartphone
10482923,"Eletroventilador Para Palio, Siena, Strada E Uno Fire - Drift - Dk60205",não-smartphone
10483706,Violão Elétrico Michael Folk Vm925dtss Aço - Sunburst Fosco,não-smartphone
10483745,Violão Elétrico Michael Folk Vm925dtst Aço - Natural Satin,não-smartphone
10483926,Capa De Silicone Fumê Para Lg G3 Stylus,não-smartphone
10483928,Capa De Silicone Fumê Para Samsung Galaxy J5,não-smartphone
10484035,Capa De Silicone Fumê Para Nokia Lumia 730,não-smartphone
10484043,Capa De Silicone Fumê Para Lg L Prime,não-smartphone
10485704,Ábaco Fechado Madeira,não-smartphone
10485814,Capa De Silicone Fumê Para Motorola Moto G,não-smartphone
10486096,Capa De Silicone Fumê Para Motorola Moto G 2014 2° Geração,não-smartphone
10486111,Capa De Silicone Fumê Para Nokia Microsoft Lumia N640 Xl,não-smartphone
10486112,Estêncil Para Pintura Simples 15x20 Estamparia Abstrata - Opa1212 - Opa,não-smartphone
10486749,Banqueta Alta 2 Cores Opzione - Maxima,não-smartphone
10488575,Colágeno Clinical Skin (300g) - Body Action,não-smartphone
10488593,Disco Flash DTC 2767,não-smartphone
10489270,Refil De Toner Para Samsung Magenta Universal 1kg,não-smartphone
10489294,Kit 4 Toners Para Brother Tn 221 Cmyk Compatível,não-smartphone
10489339,Toner Samsung Clp 325 | Clx3185fw | Y407s Yellow Compatível,não-smartphone
10489492,Fantoche - Animais Selvagens - Girafa - Papo de Pano,não-smartphone
10489507,Fantoche - Animais Selvagens - Pinguim - Papo de Pano,não-smartphone
10489822,Detetive Kit De Impressões Digitaisd,não-smartphone
10490282,Estêncil Para Pintura Simples 10x30 Bailarina - Opa699 - Opa,não-smartphone
10490294,Adaptador Visual Sound L6 Converter Cl6,não-smartphone
10490453,Cama Exclusive com Auxiliar e Grade de Proteção - Laqueado Branco - Madeira Maciça - CasaTema,não-smartphone
10490862,Encordoamento Violão Elixir 011-052 Custom Light Phosphor Bronze (5338),não-smartphone
10491210,Suporte Triplo P/ Guitarra Hercules Gs432b C/ Regulagem De Altura (2787),não-smartphone
10491315,Encordoamento Violão Nylon Nig N470 Alta Tensão Com Bolinha,não-smartphone
10491319,Encordoamento Baixo 6 Cordas Nig N760 .045.130 Escala Longa,não-smartphone
10493017,Schwarzkopf Professional 3D Men Root Activator - Shampoo 250ml,não-smartphone
10496932,Botão Adesivo Coração Iphone-Ipad,não-smartphone
10497163,Colchão de Casal Ortobom D28 Light Branco 14x128x188,não-smartphone
10497580,Capa De Tpu Para Lg L7 Ii Optimus P710 P714  Pelicula Grafite,não-smartphone
10497608,Shampoo BC Bonacure Scalp Deep Cleansing Schwarzkopf 200ml,não-smartphone
10497615,Kerastase Resistance Force Architecte Shampoo 250 Ml,não-smartphone
10497620,Capa De Tpu Para Lg G2 Mini D618 D620 D620r + Película Anti Shock Grafite,não-smartphone
10497781,Felps Xintense Máscara Nutritiva 250g,não-smartphone
10497802,Capa De Tpu Para Lg Dual Tv L40 D175 D165  Película Grafite,não-smartphone
10497803,Capa De Tpu Para Lg Optimus Ii L5 E455  Pelicula Branca,não-smartphone
10497807,Cabo De Dados Colorido Micro Usb Samsung Lg Nokia Motorola V8 Preto,não-smartphone
10498631,Balança E Cesta De Compras - Calesita,não-smartphone
10498776,Boliche De Madeiranew Art,não-smartphone
10499124,Berço mini cama Nanda Carolina Baby,não-smartphone
10499130,Colchão Casal King Verticoil Smart Preto Sistema c/ Antifungo e Antialérgico - (193x203x23 cm),não-smartphone
10500012,Capa Tpu Xiaomi Redmi 2 - Grafite,não-smartphone
10500312,Capa Tpu Lg G Pad 8.3 Polegadas V500 - Transparente,não-smartphone
10500622,Capa Personalizada Exclusiva Sony Xperia M2 Aqua D2403 D2406 - At75,não-smartphone
10500731,Capa Personalizada Exclusiva Sony Xperia M2 Aqua D2403 D2406 - Cd27,não-smartphone
10500795,Refil De Toner Para Brother  Tn 560 | Hl 5040 1kg,não-smartphone
10500802,Refil De Toner Para Brother  Tn 460 | Hl 1230 | 1440 | Mfc 9800 1kg,não-smartphone
10501070,Toalha C/ Capuz Bichinhos Bordados Ursinho Azul - Papi,não-smartphone
10501256,Refil Toner Para Brother Tn 750 | Dcp 8110dn Aton 1kg,não-smartphone
10501485,Calça Segunda Pele X-Thermo DS Lady - Solo - PRETA - PP,não-smartphone
10502530,Carregador Universal Para Notebook 100w - Multilas,não-smartphone
10502750,Capa Personalizada Exclusiva Sony Xperia T3 D5102 D5103 D5106 - Hg01,não-smartphone
10502782,Carregador Universal Para Notebook 90w - Multilase,não-smartphone
10502867,Splitter Hdmi 1.3 1 Entrada X 4 Saídas Preto Pix,não-smartphone
10503182,Switch Intelbras Sg800c 8 Portas 10/100/1000 Mbps Gigabit - 4005064,não-smartphone
10503773,Cabo Usb 10 Saídas,não-smartphone
10504239,Capa Nokia Lumia 800 - TPU Transparente,não-smartphone
10504283,Capa Iphone 4/4s - Tpu Extreme Vermelho,não-smartphone
10505254,Toca Do Pirata Com 100 Bolinhas Braskit 620-7 050090,não-smartphone
10505301,Placa De Video Msi Geforce Gtx 960 4gb Ddr5 128bits Gtx 960 4gd5t Oc,não-smartphone
10505404,Lentes Celular 4 Em 1 Telescopica Zoom 10x Universal Fisheye,não-smartphone
10508089,Capa Personalizada Exclusiva Sony Xperia Z Ultra Xl39h C6802 C6806 - Pe69,não-smartphone
10508236,Capa Personalizada Exclusiva Sony Xperia Z3 Compact Mini D5803 D5833 - Vt12,não-smartphone
10508284,Capa Personalizada Exclusiva Sony Xperia Z3 Compact Mini D5803 D5833 - Hg01,não-smartphone
10508322,Capa Personalizada Exclusiva Sony Xperia Z Ultra Xl39h C6802 C6806 - Vt12,não-smartphone
10508331,Capa Personalizada Exclusiva Sony Xperia Z3 Compact Mini D5803 D5833 - At06,não-smartphone
10508352,Capa Personalizada Exclusiva Sony Xperia Z3 Compact Mini D5803 D5833 - At49,não-smartphone
10508432,Capa Personalizada Exclusiva Sony Xperia Z Ultra Xl39h C6802 C6806 - Pe92,não-smartphone
10509685,Fonte Carregador para Lenovo IdeaPad Y560 Y560d Y560p Y570 Y570p Series - 19V 65W,não-smartphone
10510622,Toalha C/ Capuz Bichinhos Bordados Coelhinha Rosa - Papi,não-smartphone
10510628,Película De Vidro Para Samsung Galaxy Gran Prime,não-smartphone
10511067,Capa Samsung Galaxy S3 Mini TPU Preto,não-smartphone
10511083,Capa Transparente Para Samsung Galaxy E5,não-smartphone
10511096,Capa Samsung Galaxy S4 Tpu Transparente,não-smartphone
10511106,Capa Samsung Galaxy Gran Duos Tpu Preto,não-smartphone
10511118,Capa Plastica Bracadeira - Prova Dagua,não-smartphone
10511381,Capa De Silicone Fumê Para Lg F60 - Underbody,não-smartphone
10511493,Batom Vult,não-smartphone
10511494,"Vult Batom 3,5g",não-smartphone
10511667,Batom Líquido Vult Matte 05,não-smartphone
10511671,Batom Líquido Vult Matte 06,não-smartphone
10511688,Batom Vult 05,não-smartphone
10511906,Batom Vult cor 31,não-smartphone
10511912,Batom Vult Nº55,não-smartphone
10511920,Batom Vult Nº66,não-smartphone
10512043,Batom Vult Nº41,não-smartphone
10512542,Condicionador Infantil Lorys Green Shake 500ml,não-smartphone
10512598,Condicionador Infantil Lorys Baby Calêndula 500ml,não-smartphone
10512606,Condicionador Infantil Lorys Blue Shake 500ml,não-smartphone
10512610,Condicionador Infantil Lorys Purple Shake 500ml,não-smartphone
10512684,Condicionador Infantil  Acqua Kids  Erva Doce 250ml,não-smartphone
10512846,Condicionador Tresemmé Hidratação Profunda 400ml,não-smartphone
10514450,Kit 2 Trucks Especiais Alumínio para Skate Bel Fix Sports mod 4037 - Belfix,não-smartphone
10514532,Capa Personalizada Exclusiva Xiaomi Redmi 2 - Ep10,não-smartphone
10514897,Capa Silicone Transparente Para Samsung Galaxy E7,não-smartphone
10515031,Capa Samsung Galaxy S4 Mini Preto,não-smartphone
10515062,"Capa para Vade Mecum, Livros e Bíblias Marca Fácil P - Vermelha",não-smartphone
10515543,Capa Transparente Para Samsung Galaxy Gran Prime,não-smartphone
10515587,Colchão Casal Padrão Verticoil Smart Preto Sistema C/ Antifungo E Antialérgico - (138x188x23 Cm),não-smartphone
10515599,Batom Líquido Vult Matte 01,não-smartphone
10515663,"Baterial Recarregável P/ Telefone S/ Fio 600mah 2,4v Genérico",não-smartphone
10515674,Colchão Casal Queen Verticoil Smart Preto Sistema C/ Antifungo E Antialérgico - (158x198x23 Cm),não-smartphone
10515742,Rack Em Madeira Maciça Com 2 Gavetas Fort Jones - Castanho Canela,não-smartphone
10515777,Barzinho Campbell 100 Mdf Com Rodízios E Porta Garrafa - Preto Arizona,não-smartphone
10515789,Colchão Solteiro Padrão Verticoil Smart Preto Sistema c/ Antifungo e Antialérgico - (88x188x23 cm),não-smartphone
10515808,"Pilha Tamanho N 1,5v 900mah Shrink Goldpeony",não-smartphone
10515990,Colchão Solteiro Verticoil Smart Preto Sistema c/ Antifungo e Antialérgico - (78x188x23 cm),não-smartphone
10516031,Capa De Silicone De Transparente Para Iphone 6 Plus,não-smartphone
10516046,Kit Violão Elétrico Strinberg Aw53   Caixa Lx40  Capa  Acessórios - Preto,não-smartphone
10516199,Capa Transparente Para Lg G3,não-smartphone
10516219,Carga De Fumaça Com 1 Litro Dragon Neutro Laserled,não-smartphone
10516782,Capa Transparente Para Microsoft Lumia 435,não-smartphone
10517017,Kit Escova Progressiva Natu Hair Skafe 350g,não-smartphone
10517578,Refil Para Toner Samsung Ml 3710 | Scx 5637 250g,não-smartphone
10517625,Refil De Toner Para Brother Tn 350  | Hl 2040 100g,não-smartphone
10517649,Kit 4 Tintas Para Lexmark Universal Aton Black 500ml Cyan Magenta Yellow 100 Ml,não-smartphone
10517837,Refil De Toner E Chip Para Xerox 3428 | 3428dn 200g,não-smartphone
10518120,Adaptador DVI Fêmea x HDMI Macho - Genérico,não-smartphone
10518681,Esmerilhadeira Angular 4.1/2? Gws 6-115 Professional,não-smartphone
10518883,Capa Galaxy S3 - Mapa Middle Earth / Terra Média - O Hobbit,não-smartphone
10519710,Celular Blu Samba Jr Q53 Prata Dual Chip Silver,smartphone
10522304,Carregador Veicular Combo - Carregador  Power Bank E Lanterna (Cor Preta),não-smartphone
10522654,Relax Salon Line Guanidina Manga Medios Ou Finos 218g,não-smartphone
10522781,Shampoo Infantil Acqua Kids Cabelos Cacheados 250ml,não-smartphone
10522785,Shampoo Infantil Acqua Kids Maçã E Camomila 250ml,não-smartphone
10522788,Shampoo Infantil Acqua Kids Uva E Aloe Vera 250ml,não-smartphone
10522939,Shampoo Lorys Kids Blue Shake 500ml,não-smartphone
10522943,Shampoo Lorys Kids Red Shake 500ml,não-smartphone
10523291,Estêncil Para Pintura Simples 10x30 Fundo Do Mar Ii - Opa206 - Opa,não-smartphone
10523567,Perfume Ange Ou Deacute.Mon Le Parfum Amp. Son A,não-smartphone
10523569,Perfume Royal Marina Turquoise Edp Feminino 100ml,não-smartphone
10523624,Capa Rígida Para Máquina Fotográfica - Cinza,não-smartphone
10523626,Capa Rígida Para Máquina Fotográfica - Rosa,não-smartphone
10523824,Capa Rígida Para Máquina Fotográfica - Verde,não-smartphone
10523828,Capa Rígida Para Máquina Fotográfica - Azul,não-smartphone
10524313,Mini Massageador Supermedy Com Usb Preto,não-smartphone
10524314,Mini Massageador Supermedy Com Usb Azul,não-smartphone
10524344,Repetidor De Celular 1800mhz Prorc-1820 Proeletronic,não-smartphone
10524367,Repetidor De Celular 900mhz Prorc-9020 Proeletronic,não-smartphone
10525858,Shampoo Clear Men Anti Caspa Controle De Coceira 200ml,não-smartphone
10526732,Cômoda Lila Branco,não-smartphone
10527136,Carregador De Bateria 127v Cbv1600 Amarelo Vonder,não-smartphone
10527348,Carimbo Em Borracha Com Madeira Flor Catavento 003pri,não-smartphone
10527379,Violão Canhoto Elétrico Aço Natural Dallas Tuner Tagima,não-smartphone
10528012,Capa Lg L5 Ii Preta Tpu,não-smartphone
10528028,Capa Lg L5 Ii Transparente Tpu,não-smartphone
10529052,Capa Samsung Galaxy Win Duos I8552 Preta,não-smartphone
10529083,Mirror Cast Multilaser Au906 - Espelhamento De Tela Do Smartphone Ios Ou Android,não-smartphone
10529870,"Capa Alumínio Para Galaxy Siii, Prata",não-smartphone
10529884,Capa Samsung Galaxy Win Duos I8552 Rosa,não-smartphone
10530047,Estêncil Para Pintura Simples 10x30 Pimentas - Opa116 - Opa,não-smartphone
10530104,Capa Samsung Galaxy S4 Mini Rosa,não-smartphone
10530124,"Capa Alumínio Para Galaxy Siii, Rosa",não-smartphone
10530757,Capa Lg L4 Ii - Tpu Branca,não-smartphone
10531096,Capa Lg L1 - Tpu Amarela,não-smartphone
10531104,Capa Samsung Galaxy Win Duos Preta,não-smartphone
10531129,Capa Lg L4 Ii - Tpu Rosa,não-smartphone
10531159,Capa Lg L1 Tpu Transparente,não-smartphone
10531165,Capa Lg L1 Tpu Rosa,não-smartphone
10531171,Capa Flip Cover Branca - Samsung Galaxy Siii Mini,não-smartphone
10531181,Jean Paul Gaultier Le Male Edt,não-smartphone
10531606,Carregador Veicular Combo Power Bank E Lanterna Cor Roxo,não-smartphone
10531915,Capa Samsung Pocket Neo S5310 Tpu Azul,não-smartphone
10532791,Carregador Veicular Combo - Veicular Power Bank E Lanterna Cor Branco,não-smartphone
10532846,Carregador Veicular Combo - Veicular Power Bank E Lanterna. Cor Branco,não-smartphone
10532854,Carregador Veicular Combo - Veicular Power Bank E Lanterna. Cor Preto,não-smartphone
10533751,Capa Transparente Para Motorola Moto X 2 Geração,não-smartphone
10534201,Capa Samsung Pocket Neo Tpu Preto,não-smartphone
10534440,Capa De Silicone Fumê Para Nokia 520,não-smartphone
10535095,Capa Preta Para Microsoft Lumia 535,não-smartphone
10535187,Capa Samsung Pocket Neo Tpu Rosa,não-smartphone
10535189,Capa Samsung Pocket Neo Tpu Transparente,não-smartphone
10535190,Capa Samsung Pocket Neo S5310 TPU Vermelho,não-smartphone
10536342,Capa Samsung Pocket Neo Tpu Branco,não-smartphone
10537296,Capa Samsung Tab 3 7.0 T210 Tpu Rosa,não-smartphone
10537322,Capa Motorola Moto G TPU Transparente,não-smartphone
10538240,Capa Samsung Galaxy Ace 3 Flip Azul,não-smartphone
10538528,Capa De Silicone Fumê Para Nokia 630,não-smartphone
10539110,Capa Samsung Galaxy Ace 3 SII Duos Tv TPU Rosa,não-smartphone
10539415,Capa Samsung Galaxy Ace 3 SII Duos Tv TPU Azul,não-smartphone
10539823,Capa Personalizada Exclusiva Motorola Moto G3 3ª Geração - Cv12,não-smartphone
10539869,Tinta Color Keune 60ml - Cores   6.38 -  Louro Escuro Avelã  6.38 -  Louro Escuro Avelã  6.38 -  Louro Escuro Avelã,não-smartphone
10540000,Capa Personalizada Exclusiva Motorola Moto G3 3ª Geração - At75,não-smartphone
10540095,Capa Personalizada Exclusiva Motorola Moto G3 3ª Geração - Pe17,não-smartphone
10540120,Capa Personalizada Exclusiva Motorola Moto G3 3ª Geração - Tx55,não-smartphone
10540860,Cômoda Com 5 Gavetas S725 Kappesberg Branco,não-smartphone
10541126,Cooler Ventilador 80x80 X25mm P/Placa Sleeve 3p Evercool,não-smartphone
10541884,Kit Shampoo + Condicionador Niely Gold Pós Química,não-smartphone
10542004,Bloco de Encaixe Bateria Antiaérea 226 peças Xalingo,não-smartphone
10542006,Blocos De Encaixe - Corrida Maluca - Sem Limites - 59 Peças - Xalingo,não-smartphone
10542013,Blocos de Encaixe Salão de Beleza 91 Peças - Xalingo,não-smartphone
10542092,Máscara Eico Fios De Ouro 240g,não-smartphone
10542324,Shampoo Capicilin Redutor De Volume Disciplinante 250ml,não-smartphone
10542327,Shampoo Anti Caspa Clear Men Ice Cool Menthol 200ml,não-smartphone
10542332,Shampoo Dove Óleo Nutrição 200ml,não-smartphone
10542369,Shampoo Dove Men  Care Limpeza Refrescante 200ml,não-smartphone
10542393,Shampoo Dove Reconstrução Completa 200ml,não-smartphone
10542416,Shampoo Anti Caspa Clear Women Crescimento E Força 200Ml,não-smartphone
10542446,Shampoo Baby Gotas de Brilho 200ml - Johnson & Johnson,não-smartphone
10543402,Wella Professionals Color Touch Pure Naturals 4/0 Castanho Médio 60g,não-smartphone
10543603,Capa Silicone Transparente Para Samsung Galaxy S5 Duos  - Underbody,não-smartphone
10544056,Capa De Silicone Fumê Para Samsung Galaxy Alpha,não-smartphone
10546526,Capa Lg G2 Tpu Preto,não-smartphone
10546532,Capa Lg G2 Tpu Branco,não-smartphone
10546566,Capa Lg G2 Tpu Rosa,não-smartphone
10546797,Capa Transparente Para Asus Zenfone 5,não-smartphone
10546861,Capa Samsung Galaxy Win Duos Ultra Slim Azul,não-smartphone
10546864,Capa Samsung Galaxy Win Duos Ultra Slim Cinza,não-smartphone
10546901,Capa Samsung Galaxy Win Duos Ultra Slim Transparente,não-smartphone
10546904,Capa Samsung Galaxy Win Duos Ultra Slim Rosa,não-smartphone
10546923,Capa Samsung Galaxy Win Duos Ultra Slim Verde,não-smartphone
10547514,Bumper Motorola Moto G Branca,não-smartphone
10547893,Capa Samsung Galaxy Win Duos Ultra Slim Vermelha,não-smartphone
10548357,Bumper Samsung Galaxy S5 Azul,não-smartphone
10548926,Capa Lg L70 Tpu Branca,não-smartphone
10553279,Bracadeira Samsung Galaxy Alpha,não-smartphone
10553283,Bracadeira Iphone 4,não-smartphone
10553333,Bracadeira Samsung Galaxy A3,não-smartphone
10553352,Bracadeira Lg L90,não-smartphone
10553363,Bracadeira Iphone 5,não-smartphone
10553429,Bracadeira Iphone 5c,não-smartphone
10553827,Relé Temporizador De Vidros Elétricos,não-smartphone
10553848,"Tsa 060011 Boias Tubularanjaes Uno, Premio, Elba, Fior",não-smartphone
10553872,"Sensor De Pressão  Delphi Blazuler, Corsa, Ipanema,",não-smartphone
10553879,"Bobina Do Distribuidor  Delphi Ipanema, Kadett, Mo",não-smartphone
10553880,"Tampa Do Distribuidor  Delphi Ipanema, Kadett, Mon",não-smartphone
10553891,Regulador De Voltagem 853-14v,não-smartphone
10553921,Tsa 060002 Boias Tubularanjaes Tempra,não-smartphone
10553971,Bracadeira Motorola Moto E,não-smartphone
10554011,Filtro De Combustivel Wega  Airtrek,não-smartphone
10554044,"Sensor Temperatura Ar Iguaçu Golf, Kombi, Passat V",não-smartphone
10554045,"Sensor Temperatura Ar Iguaçu Clio, Laguna, Megane,",não-smartphone
10554047,Sensor Temperatura Ar Iguaçu Pontiac (Usa),não-smartphone
10554057,"Regulador De Voltagem 063 - 14v Bmw 74i 4.4l, 75i",não-smartphone
10554063,"146sp280h Correia Dentada Dayco, Pt Cruiser",não-smartphone
10554068,Placa De Diodos  Honda Toyota Hilux Pit Bull Acura,não-smartphone
10554097,"Sensor De Pressão  Delphi Astra, Blazuler, S10, Vect",não-smartphone
10554099,Válvula Elétrica Do Canister (Ccp)  Delphi Corsa,não-smartphone
10554102,"Sensor De Posição Da Borboleta  Delphi Celta, Cors",não-smartphone
10554108,"Sensor Temperatura Ar Iguaçu Blazuler, S10, Silverad",não-smartphone
10554111,"Sensor Temperatura Ar Iguaçu Chrysler, Dodge, Pont",não-smartphone
10554132,"Filtro De Oleo Wega  Serie 1 118i, Serie 1 120i, S",não-smartphone
10554154,Bracadeira Motorola Moto X,não-smartphone
10554175,"Sensor De Pressão  Delphi Kadett, Vectra, Accent",não-smartphone
10554196,"Bico Injetor  Delphi Doblo, Idea, Palio, Punto, Si",não-smartphone
10554198,Regulador De Voltagem 784 - 14v,não-smartphone
10554199,"Regulador De Voltagem 232 - 14v Bmw 3, 5, Z3, X5",não-smartphone
10554205,Regulador De Voltagem 789 - 14v,não-smartphone
10554218,"Sensor Temperatura Painel Iguaçu 26-220, 26-300, 4",não-smartphone
10554234,Placa De Diodos  Mitsubishi Pajero 3.2,não-smartphone
10554242,"Placa De Diodos  Ford Focus I, Mondeo, Ecosport",não-smartphone
10554245,Regulador De Voltagem 343 - 14v,não-smartphone
10554246,Regulador De Voltagem 472 - 14v,não-smartphone
10554249,Regulador De Voltagem 809-14v,não-smartphone
10554251,Regulador De Voltagem 856 - 14v,não-smartphone
10554252,Regulador De Voltagem 878 - 14v,não-smartphone
10554254,Regulador De Voltagem 858-14v,não-smartphone
10554268,Sensor Maf - 7168 - Mte-Thomson,não-smartphone
10554300,"Sensor Temperatura Ar Iguaçu Escort Hatch, Escort",não-smartphone
10554359,Fita Isolante Preta Com Cola,não-smartphone
10554420,"Placa De Diodos  Gm Omega Australiano 3.8 V6, Kia",não-smartphone
10554467,"Filtro De Combustivel Wega  Camry, Corolla, Coroll",não-smartphone
10554484,Bracadeira Para Moto G,não-smartphone
10554506,Bracadeira Samsung Galaxy S4 Mini,não-smartphone
10554536,Capa iPhone 6 Plus TPU Branco,não-smartphone
10554547,Combo 3 + 2 garras longas Espetoflex - Espeto giratório movido a pilha.,não-smartphone
10554559,Capa Motorola Moto G2 TPU Preto,não-smartphone
10554571,Bracadeira Sony Xperia Z3 Compact - Underbody,não-smartphone
10554578,Capa Motorola Moto G2 TPU Rosa,não-smartphone
10554582,Capa iPhone 6 Plus TPU Preto,não-smartphone
10554703,Capa Iphone 6 Plus Cartoon Rosa,não-smartphone
10554907,Película de vidro ultra temperado Asus Zenfone 5 A501,não-smartphone
10554911,Película De Vidro Temperada Motorola Moto G 3 Geração,não-smartphone
10555052,Película De Vidro Ultra Temperado Motorola Moto G 2014,não-smartphone
10555092,Capa Samsung Galaxy Core Plus Tv Pc Couro Branco,não-smartphone
10555104,Capa Samsung Galaxy Core Plus Tv Pc Couro Preto,não-smartphone
10555135,Película De Vidro Ultra Temperado Motorola Moto X Style,não-smartphone
10555242,Película De Vidro Ultra Temperado Samsung Galaxy Grand Prime G530,não-smartphone
10555253,Schwarzkopf Osis Magic Finish Sérum 50ml,não-smartphone
10555284,"Película de vidro ultra temperado iPhone 5, 5s, 5c",não-smartphone
10555460,Capa Lg L40 Pc Couro Preto,não-smartphone
10555462,Capa Samsung Galaxy S5 Mini Pc Couro Branco,não-smartphone
10555464,Película De Vidro Ultra Temperado Lg L70,não-smartphone
10555477,Capa Motorola Moto G Pc Couro Preto,não-smartphone
10555501,Capa Lg L70 Pc Couro Preto,não-smartphone
10555517,Película De Vidro Ultra Temperado Motorola Moto X 2ª Geração,não-smartphone
10555560,Película De Vidro Ultra Temperado Lg G3 Stylus,não-smartphone
10555760,Película De Vidro Ultra Temperado Lg L Prime,não-smartphone
10555786,Película De Vidro Ultra Temperado Sony Xperia Z3,não-smartphone
10556101,Interface Celular Intelbras Quad Band Central Telefonica Itc 4100,não-smartphone
10556111,Bumper Iphone 6 Branco,não-smartphone
10556193,"Guardanapo De Papel Folha Simples 32,5 X 32,5cm Pacote Com 50 Unidades Santepel",não-smartphone
10556218,Canudo De Papel Bambu Com 20 Unidades Bicão,não-smartphone
