ID,TITLE,CLASSE
10598430,Bote Minnie E Margarida Rosa 91025 - Bestway,não-smartphone
10598441,Piscina Princess 982 Litros Rosa 91049 - Bestway,não-smartphone
10598453,Bote Princess Rosa 91044 - Bestway,não-smartphone
10598454,Bote Spider-Man Azul/Vermelho 98004 - Bestway,não-smartphone
10598458,"4Whey Tech 1,8kg - Atlhetica Nutrition",não-smartphone
10598471,Bóia De Braço Minnie Mouse Bestway Echolife,não-smartphone
10598981,Papel Scrapbook Duplo Multitons Xadrez Diversão no Gelo KFSB391 By Vlady – Toke e Crie,não-smartphone
10599451,Capa Nokia 530 Tpu Rosa,não-smartphone
10599459,Capa Motorola Moto e TPU Branco,não-smartphone
10599463,Bumper Motorola Moto E Azul,não-smartphone
10599464,Papel Scrapbook Duplo Multitons Poa e Listra Grandes Vermelho KFSB381 By Vlady – Toke e Crie,não-smartphone
10599471,Capa Lg L65 Tpu Branco,não-smartphone
10599476,Capa Lg L50 Tpu Branco,não-smartphone
10599480,Capa Lg L65 Tpu Preto,não-smartphone
10599482,Capa Lg G2 Mini Tpu Preto,não-smartphone
10599483,Dragão Banguela De Luxo - Sunny 1087,não-smartphone
10599488,Capa Motorola Moto E TPU Esmalte Prata,não-smartphone
10599493,Capa Motorola Moto E TPU Rosa,não-smartphone
10599501,Capa Motorola Moto E TPU Esmalte Branco,não-smartphone
10599505,Capa Flip Cover Motorola Moto E Preto,não-smartphone
10599506,Capa Lg L50 Tpu Rosa,não-smartphone
10599511,Capa Lg L65 Tpu Rosa,não-smartphone
10599521,Capa Samsung Galaxy Duos 2 Tpu Branco,não-smartphone
10599530,Bumper Motorola Moto E Rosa,não-smartphone
10599531,Capa Motorola Moto E TPU Esmalte Preto,não-smartphone
10599553,Capa Nokia 530 TPU Branco,não-smartphone
10599569,Capa Samsung Galaxy S Duos 2 Tpu Transporte,não-smartphone
10599574,Capa Iphone 6 Tpu Rosa,não-smartphone
10599575,Capa Motorola Moto E TPU Preto,não-smartphone
10599582,Capa Lg G2 Mini Tpu Branco,não-smartphone
10599705,Kit Capa + Pelicula Nokia 530 TPU Transparente,não-smartphone
10599711,Capa Samsung T117 Flip Preto,não-smartphone
10601804,Cartão de Memória 16GB Micro SDHC com Adaptador SRAC-A1 - Sony,não-smartphone
10601999,Cadeira Side Infantil Base Madeira Laranja Cadsif-Ma-Lr By Haus,não-smartphone
10602635,Pelicula De Vidro Temperado Xiaomi Redmi,não-smartphone
10603893,Capa Samsung Galaxy S4 New York,não-smartphone
10603921,Capa Nokia 720 TPU Roxo,não-smartphone
10604067,Capa Samsung Galaxy Fame/Fame Duos Pc Preto,não-smartphone
10604071,Capa Samsung Tab 3 7 Rotate Marrom,não-smartphone
10604072,Capa Samsung Galaxy Mega 6.3 Flip Rosa,não-smartphone
10604073,Capa Motorola D1 Pc Colorido You Make Me Smile,não-smartphone
10604076,Capa Samsung Galaxy Fame Flip Preto,não-smartphone
10604078,Capa Samsung Tab 3 8 Rotate Rosa,não-smartphone
10604082,Capa Samsung Galaxy S4 Caveira Pc Preto,não-smartphone
10604086,Capa Nokia 720 TPU Rosa,não-smartphone
10604088,Capa Motorola Moto X TPU Amarelo,não-smartphone
10604093,Capa Nokia 720 TPU Cinza,não-smartphone
10604100,Capa Motorola Moto X TPU Azul,não-smartphone
10604103,Capa Samsung Galaxy Mega 6.3 Flip Branco,não-smartphone
10604118,Capa Samsung Galaxy Duos Pc Colorida Rosa,não-smartphone
10604136,Capa Nokia 720 TPU Azul,não-smartphone
10604146,Capa Nokia 720 TPU Branco,não-smartphone
10604148,Capa Samsung Galaxy S4 Pc Coração,não-smartphone
10604156,Capa Motorola Moto X TPU Cinza,não-smartphone
10604160,Capa Motorola Moto X TPU Rosa,não-smartphone
10604162,Capa Iphone 5/5s Pc Motocicleta,não-smartphone
10604179,Capa Samsung Galaxy Young Tpupc Branco,não-smartphone
10604182,Capa Samsung Galaxy Ace 3/SII Duos Tv Couro Preto,não-smartphone
10604203,Capa Samsung Galaxy Fame Tpu Gel Roxo,não-smartphone
10604204,Capa Samsung Galaxy Young Couro Carteira Rosa,não-smartphone
10604205,Capa Nokia 720 TPU Amarelo,não-smartphone
10604213,Capa L3 Ii Pc Preto Liso,não-smartphone
10604220,Capa Samsung Galaxy Young TPU Branco,não-smartphone
10604230,Capa Samsung Galaxy Fame Tpu Transparente,não-smartphone
10604296,Capa Samsung Galaxy Fame Tpu Gel Cinza,não-smartphone
10604306,Capa Nokia 720 TPU Transparente,não-smartphone
10604319,Capa Samsung Galaxy Win Duos Flip Vermelho,não-smartphone
10604322,Capa Samsung Galaxy Fame Piano,não-smartphone
10604324,Capa Samsung Galaxy S4 Pc Pac Man,não-smartphone
10604333,Capa Nokia 720 TPU Vermelho,não-smartphone
10604335,Capa Samsung Galaxy S4 Pc Now Preto,não-smartphone
10604369,Capa Galaxy Fame/Fame Duos TPU Gel Azul,não-smartphone
10604469,Capa Motorola Moto X TPU Vermelho,não-smartphone
10604703,Bumper Samsung Galaxy Fame Transparente/Branco,não-smartphone
10604710,Bagageiro de teto Thule Box Pacific 200 Preta - 410 Litros,não-smartphone
10604715,Capa Samsung Galaxy S3 Brilho Rosa,não-smartphone
10604946,SimFort (Lactobacilos) (30saches) - Vitafor,não-smartphone
10604979,Simfort (Lactobacilos) (10saches) - Vitafor,não-smartphone
10605165,Película de vidro ultra temperado Moto G 3 Geração,não-smartphone
10608313,"Tracta - Batom HD MATTE - Cor de Boca II 47 - 3,5g",não-smartphone
10608383,Açúcar Cristal Verde Com 500g Mix,não-smartphone
10608392,Ágar Ágar Com 30g Mix,não-smartphone
10609942,Toner Para Impressora Hp Cf83x | Cf-83 | M5 Compatível .5k,não-smartphone
10610060,Pelicula Premium De Vidro Temperado Hprime Xperia E4,não-smartphone
10611068,Caminhão Polux Basculante Silmar 6620,não-smartphone
10611582,Estêncil Para Pintura Duplo 14x14 Passaro - Opa1748 - Opa,não-smartphone
10611911,Capa para Vade Mecum com Alça de Ombro Inspiração,não-smartphone
10612144,Cooktop Fischer Vitrocerâmico 2 Bocas Preto Indução Elétrico 220V,não-smartphone
10612210,Móbile Musical Giratório Infantil Sol 20055 - Braskit,não-smartphone
10613857,Co Tresemme Blindagem Platinum 400ml,não-smartphone
10614297,Colchão Mimi Cama Ecoline Natural 150X070x012 D18 - ECOFLEX,não-smartphone
10615480,Sapatilha Lilly's Closet Com Laço,não-smartphone
10615481,Sapatilha Metalizada Lilly's Closet Com Laço,não-smartphone
10615895,Antena Externa Para Celular 800 Mhz 17dbi Cf817 Aquário,não-smartphone
10615916,Kit 4 Refis De Toner Para Hp Cp1215 High Definition Aton Cmyk,não-smartphone
10615923,Bateria Externa E2u - 10200mah,não-smartphone
10615962,Capa para Vade Mecum com Alça de Ombro Mistério,não-smartphone
10616106,Papel Scrapbook Dupla Face Mini Flor KFSB351- Toke e Crie,não-smartphone
10616152,Estêncil Para Pintura Simples 4x30 Heras - Opa7661 - Opa,não-smartphone
10616175,Papel Scrap Puro Glitter Rosa Coral SDPG18 - Toke e Crie,não-smartphone
10616177,Adesivo Borda Artesanal II Bebê Menino AD1537 - Toke e Crie,não-smartphone
10616409,Adesivo Emborrachado Ursos Ad497 - Toke E Crie,não-smartphone
10616437,Capa para Vade Mecum com Alça de Ombro Harmonia,não-smartphone
10616645,"Colchão Casal Ecoline D-45 C/ Sistema Antiácaro, Antifungo E Antialérgico (138x188x20)",não-smartphone
10616652,"Colchão Casal Queen Ecoline D-45 C/ Sistema Antiácaro, Antifungo E Antialérgico (158x198x25)",não-smartphone
10617233,Colchão Ecoline Espuma Altura 25cm D40 Branco Ecoflex Antifungo E Antialérgico,não-smartphone
10617247,"Colchão Casal Ecoline D-33 C/ Sistema Antiácaro, Antifungo E Antialérgico (138x188x20)",não-smartphone
10617250,"Colchão Casal Ecoline D-23 C/ Sistema Antiácaro, Antifungo E Antialérgico (138x188x17)",não-smartphone
10617253,"Colchão Casal Ecoline D23 Sistema Antiácaro, Antifungo e Antialérgico 138x188cm - Ecoflex",não-smartphone
10617261,"Colchão Casal Ecoline D-33 C/ Sistema Antiácaro, Antifungo E Antialérgico (138x188x14)",não-smartphone
10617264,"Colchão Casal Ecoline D-23 C/ Sistema Antiácaro, Antifungo E Antialérgico (138x188x20)",não-smartphone
10617954,Capa para Vade Mecum com Alça de Ombro Nobreza,não-smartphone
10617956,Base Liquida Soft Dailus - 08 30g - Bege Escuro,não-smartphone
10618134,"Cama Infantil Prime Com Grade De Proteção, Telhado Completo E Kit Escadinha/ Escorrega - Casatema",não-smartphone
10619602,Capa Case Galaxy Tab A - 9.7´ P550/P555 Carteira / Caneta Touch (Rosa),não-smartphone
10619976,Aéreo Infantil Eloísa Com 3 Portas - Branco - Phoenix Baby,não-smartphone
10620362,Carboplex Malto 1kg - Advanced Nutrition-Laranja,não-smartphone
10620382,Carboplex Malto 1kg - Advanced Nutrition-Neutro,não-smartphone
10620405,Carboplex Malto 1kg - Advanced Nutrition,não-smartphone
10620450,Collagen Powder 300gr - Integralmédica,não-smartphone
10620466,"Whey Zero 4,4lbs - Black Skull-Baunilha",não-smartphone
10620490,Monstrous 6lbs - Black Skull,não-smartphone
10620518,Exceed Energy Gel (cx c/ 10 uni) - Advanced Nutrition,não-smartphone
10620555,100% Whey 900gr - Brn Foods,não-smartphone
10620562,Iso Protein 2kg - Brn Foods-Chocolate,não-smartphone
10620568,Size Mass 72.700 3kg - Brn Foods,não-smartphone
10620574,Whey Micellar 900 G - Br Foods,não-smartphone
10620603,Exceed Energy Gel (Unidade) - Advanced Nutrition-Baunilha,não-smartphone
10620628,Whey Muscle Hammer 900gr - Body Action,não-smartphone
10620656,Giant Whey Refil Bodybuilders Chocolate 2Kg,não-smartphone
10620686,Giant Whey 908gr - Bodybuilders-Morango,não-smartphone
10620740,Isolate Definition 900 G - Body Action,não-smartphone
10620743,Maltodextrina 1kg - Body Action-Jabuticaba,não-smartphone
10620761,Carboplex Malto 1kg - Advanced Nutrition-Limão,não-smartphone
10620769,Whey Zero 900 G - Black Skull,não-smartphone
10620773,Whey 4HD 2lbs - Black Skull,não-smartphone
10620802,Exceed Energy Gel (Unidade) - Advanced Nutrition-Chocolate,não-smartphone
10620816,100% Whey 900gr - Brn Foods,não-smartphone
10620832,Size Mass 72.700 3kg - Brn Foods,não-smartphone
10620834,WHEY FOODS 2kg - MORANGO,não-smartphone
10620835,Size Mass 72.700 3kg - Brn Foods,não-smartphone
10621149,Waxy Mass Refil Bodybuilders Morango 3kg,não-smartphone
10621172,"Whey Zero 4,4lbs - Black Skull",não-smartphone
10621384,Papel Scrapbook Folha Simples Xadrez Azul e Verde LSC-213 - Litocart,não-smartphone
10621436,Alfaparf Nutri Seduction Luxury Máscara Condicionadora 150g,não-smartphone
10621534,Exceed Energy Gel (cx c/ 10 uni) - Advanced Nutrition,não-smartphone
10621726,Papel Scrapbook Folha Dupla Flor e Listra LSCD-311 - Litocart,não-smartphone
10621857,"Colchão Casal Celebrity D-28 selado c/ Sistema Antiácaro, Antifungo e Antialérgico (188x138x17 cm)",não-smartphone
10621920,Colchão Espuma D-20 Pro Luckspuma Selado Liso 12Cm - Solteiro 12x78x188 Cm,não-smartphone
10622060,Exceed Energy Gel (cx c/ 10 uni) - Advanced Nutrition-Banana,não-smartphone
10622171,"Colchão para Berço Baby Luckinho c/ Sistema Antiácaro, Antifungo e Antialérgico D18 (130x60x12 cm)",não-smartphone
10622206,Microsoft Office Integrado,não-smartphone
10622291,"Colchão Solteiro Supreme D-33 Selado C/ Sistema Antiácaro, Antifungo E Antialérgico (188x88x17 Cm)",não-smartphone
10622593,Brinquedo Para Montar Policia Carro Policial 98pcs Play Cis,não-smartphone
10622699,Blocos De Montar - Click It - Super Moto Cyclone - 118 Peças,smartphone
10624041,Corretivo Soft Dailus,não-smartphone
10626253,Capa Fit Ultra Slim Motorola Razr D3 Xt919 Xt920 + Pelicula Grafite,não-smartphone
10627606,Isolon 2lbs - Black Skull,não-smartphone
10627613,Isolon 2lbs - Black Skull,não-smartphone
10627692,Hydrolisys 2lbs - Black Skull-morango,não-smartphone
10627703,Exceed Energy Gel (unidade) - Advanced Nutrition-Tangerina,não-smartphone
10627708,Hidrolysis 907g - Black Skull - Baunilha,não-smartphone
10627712,Bcaa Powder (300g) - Black Skull By Eduardo Corrêa - Limão,não-smartphone
10628244,Capa Lg L1 Ii Tpu Cinza,não-smartphone
10628247,Relógio Champion Feminino Passion Ch24259h,não-smartphone
10628258,Capa Samsung Galaxy Trend Lite S7392 Tpu Preto,não-smartphone
10628272,Capa Lg L4 Ii Tpu Azul,não-smartphone
10628276,Capa Samsung Galaxy S4 Verde,não-smartphone
10628278,Capa Motorola Moto G PC Emborrachado Branco,não-smartphone
10628284,Capa Motorola Moto G Tpu Miss,não-smartphone
10628296,Capa Motorola Moto E PC Preto,não-smartphone
10628309,Capa Iphone 6 Tpu Flores,não-smartphone
10628318,Capa Samsung Galaxy S5 Tpu Esmalte Branco,não-smartphone
10628322,Capa Motorola Moto G PC Couro Branco,não-smartphone
10628323,Capa Motorola Moto E TPU Esmalte Vermelho,não-smartphone
10628337,Capa Motorola Moto E Flores,não-smartphone
10628348,Capa Samsung Galaxy Young Roxo,não-smartphone
10628354,Capa Motorola Moto G PC+TPU Tripla Proteção Azul,não-smartphone
10628355,Capa Samsung Galaxy S5 Mini PC Premium Rosa,não-smartphone
10628360,Capa Samsung Galaxy S5 Dobravel Dourado Transparente,não-smartphone
10628379,Capa Motorola Moto G PC Couro Vermelho,não-smartphone
10628385,Capa iPhone 6 PC+TPU Vermelho,não-smartphone
10628415,Refil De Toner Para Samsung Scx 4725 | Scx 4725fn 1kg,não-smartphone
10628523,Capa Samsung Galaxy S5 PC Couro Branco,não-smartphone
10629049,Batman-Sacola De Praia Rosita 9666,não-smartphone
10629432,Batman-Balde De Praia Rosita 9665,não-smartphone
10629456,Capa Motorola Moto G2 Tpu Jornal,não-smartphone
10629476,Capa Lg L4 Ii Tpu Vermelho,não-smartphone
10629482,Capa Motorola Moto E Brilho Dourado,não-smartphone
10629484,Capa Motorola Moto E TPU Verde,não-smartphone
10629490,Capa Lg L1 Tpu Vermelho,não-smartphone
10629494,Capa Motorola Moto G2 TPU+PC Rosa/Preto,não-smartphone
10629503,Capa Lg L5 Ii Tpu Vermelho,não-smartphone
10629517,Capa Motorola Moto G TPU Verde,não-smartphone
10629520,Capa iPhone 6 Plus Dobravel Branco,não-smartphone
10629525,Capa Motorola Moto E TPU Vermelho,não-smartphone
10629529,Capa Motorola Moto E Tpu Zebra,não-smartphone
10629536,Capa Motorola Moto E TPU Esmalte Rosa,não-smartphone
10629537,Capa iPhone 6 Plus PC Branco,não-smartphone
10629579,Bumper Motorola Moto E Amarelo,não-smartphone
10629609,Capa Iphone 5/5s Gelo Rosa,não-smartphone
10629610,Capa Samsung Galaxy S4 Tpu Azul,não-smartphone
10629626,Capa Samsung Galaxy Grand Duos Branco,não-smartphone
10629651,Capa Samsung Galaxy Pocket Rosa,não-smartphone
10629672,Capa Samsung Galaxy S Duos Tpu Verde,não-smartphone
10629679,Capa Iphone 4/4s Hello Kitty Rosa,não-smartphone
10629682,Capa Motorola Moto E Brilho Prata,não-smartphone
10630028,Exceed Energy Gel (cx c/ 10 uni) - Advanced Nutrition,não-smartphone
10630214,Polo Malha Piquet Luk Básica Laranja P,não-smartphone
10630223,Polo Malha Piquet Luk Básica Azul Marinho P,não-smartphone
10630245,Polo Malha Piquet Luk Básica Pink P,não-smartphone
10630263,Polo Malha Piquet Luk Básica Rosa Claro P,não-smartphone
10630266,Polo Malha Piquet Luk Básica Vermelho P,não-smartphone
10630290,Capa Lg L1 Tpu Azul,não-smartphone
10630358,Refil Para Toner Brother Tn 110 | Tn 115 | Dcp 9040 | Hl 4040 | Mfc 9440 | Mfc 9840 Cyan 140g,não-smartphone
10630435,Capa Lg L3 Ii Tpu Preto,não-smartphone
10630921,"Fritadeira Kit Fritas Eirilar 2,5 Litros com Grelha Removível",não-smartphone
10631886,Cabo Apple Cabo De Lightning Para Usb (2m) (Md819bz/A),não-smartphone
10631906,Caneca Porcelana Dc Coringa- 300 Ml,não-smartphone
10631931,Kit 4 Tintas Para Epson Bulk Ink 196 Black 1 Litro Coloridas 500ml Compatível,não-smartphone
10632179,Capa Motorola Moto E Rosas,não-smartphone
10632405,Capa Motorola Moto G TPU Esmalte Dourado,não-smartphone
10632488,Capa Samsung Galaxy S4 Tpu Branco,não-smartphone
10632549,Caneca Porcelana Dc Hahaha Coringa,não-smartphone
10632700,Relógio Diesel Mega Chief DZ4320/0PN,não-smartphone
10632705,Relógio Diesel Doubledown Dz4313/Bn,não-smartphone
10633073,Capa Motorola Moto G Couro Carteira Branco,não-smartphone
10633360,Churrasqueira A Gás Para 20 Espetinhos Em Inox Agi-20 - Arke,não-smartphone
10633439,Bag Rockbag Eco Line P/ Violão Clássico Rb 20538 B,não-smartphone
10634581,Tinta Sublimatica Inkprinter Para Transfer E Sublimação Impressora Epson (4x250 Ml),não-smartphone
10634831,Capa para Vade Mecum com Alça de Ombro Veneza,não-smartphone
10634876,Episol Color Morena Mais Fps30 Loc 40g,não-smartphone
10635307,Gabinete K-Mex Cg-04a6 - Usb 3.0 - Sem Fonte,não-smartphone
10635362,Cooler Akasa Venom Voodoo - Universal Amd E Intel - Ak-Cc4008hp01,não-smartphone
10635397,Water Cooler Corsair Hydro Series H80i Gt High Performance - Cw-9060017-Ww,não-smartphone
10635446,Cabo Usb Para Mini Usb - 4 Pinos Mini B-4 - Para Câmera Digital,não-smartphone
10635458,Cabo Conversor Usb Para Rj45 - Trendnet Tu2-Et100,não-smartphone
10635467,Cabo Hdmi 1.4 - 10 Metros - 3d High Speed Full Hd - Gold Flash - Akasa - Ak-Cbhd02-100,não-smartphone
10635470,Cooler 120x120mm Cooler Master Sickle Flow X - R4-Sxnp-20fk-R1,não-smartphone
10635475,Gabinete Cooler Master Cosmos Se - Com Cooler Led Azul - Usb 3.0 - Cos-5000-Kwn1,não-smartphone
10635512,Cooler Akasa Para Intel Ak-Cc7129ep0 (Lga 775/115x) - Mini-Itx,não-smartphone
10635544,"Carregador Usb Para Celulares, Psps, Ipods E Iphones, Mp3 - C3 Tech Uc-09",não-smartphone
10635553,Gabinete K-mex Cg-03a6 - Usb 3.0 - Sem Fonte,não-smartphone
10635597,Adesivo Quadrado Arabesco Com Flor Laq-96 - Litocart,não-smartphone
10635702,Agua Thermal Vichy 300ml,não-smartphone
10635755,Neovadiol Concentrado 30ml,não-smartphone
10635771,Shampoo Vichy Dercos Nutrirreparador,não-smartphone
10635776,Água Termal Vichy 150ml,não-smartphone
10636321,Creme de Tratamento  Dove Reconstrução Completa 350g,não-smartphone
10636405,Mixer de Mão 5 Velocidades Pro Line,não-smartphone
10636409,Tinta Sublimatica Inkprinter Para Transfer E Sublimação Impressora Epson (4x100 Ml),não-smartphone
10636410,Tinta Sublimatica Inkprinter Para Transfer E Sublimação Impressora Epson (4x500 Ml),não-smartphone
10636802,Galaxy Tab E 9.6 Wi-Fi,não-smartphone
10637282,Capa Flip Cover Samsung Galaxy Y Duos S6102 Preto,não-smartphone
10637285,Capa Samsung Galaxy Pocket S5300 Transparente,não-smartphone
10637289,Capa Flip Cover Samsung Galaxy Grand Duos Azul Claro,não-smartphone
10637298,Capa Motorola D1 PC Robotic Silicone Preto e Verde,não-smartphone
10637305,Capa Motorola D3 Couro Branco,não-smartphone
10637317,Capa Flip Cover Samsung Galaxy Young Preto,não-smartphone
10637318,Capa Samsung Galaxy Y Duos S6102 Tpu Branco,não-smartphone
10637322,Capa Samsung Galaxy S4 Ultra Slim Branco,não-smartphone
10637332,Capa Flip Cover Samsung Galaxy S Duos Rosa,não-smartphone
10637333,Capa Samsung Galaxy Ace 3 Super Tpu Branco,não-smartphone
10637340,Capa Samsung Galaxy S4 Pc Just Be Cool,não-smartphone
10637341,Capa Motorola Moto G2 Couro Rosa,não-smartphone
10637346,Capa Flip Cover Samsung Galaxy S4 Window Verde,não-smartphone
10637348,Capa Samsung Galaxy Pocket Tpu Roxo,não-smartphone
10637361,Capa Flip Cover Samsung Galaxy Fame Rosa,não-smartphone
10637364,Capa Motorola D1 TPU Cinza,não-smartphone
10637376,Capa Motorola Moto G2 TPU Amarelo,não-smartphone
10637378,Capa Samsung Galaxy S3 I9300 Pc Branco,não-smartphone
10637384,Capa Samsung Galaxy S4 Pc Transparente,não-smartphone
10637395,Capa Motorola D1 TPU Amarelo,não-smartphone
10637399,Bumber Motorola D3 Transparente Com Roxo,não-smartphone
10637414,Capa Flip Cover Samsung Galaxy S3 Rosa,não-smartphone
10637417,Capa Samsung Galaxy S4 Couro De Cobra,não-smartphone
10637444,Capa Samsung Galaxy S4 Pc Happy,não-smartphone
10637448,Capa Samsung Galaxy Mini S5570 Tpu Transparente,não-smartphone
10637457,Capa Motorola D1 TPU Verde,não-smartphone
10637462,Capa Samsung Galaxy S3 I9300 Ultra Slim Azul,não-smartphone
10637463,Capa Samsung Galaxy S3 Mini PC Transparente,não-smartphone
10637465,Capa Flip Cover Samsung Galaxy S4 Mini Roxo,não-smartphone
10637475,Capa Iphone 4/4s Bbuble Roxo,não-smartphone
10637476,Capa Samsung Galaxy S4 Estrelas,não-smartphone
10637481,Capa Motorola D3 TPU Roxo,não-smartphone
10637482,Capa Samsung Galaxy S4 Couro Branco,não-smartphone
10637492,Capa Samsung Galaxy Win Duos Tpu Copa Brasil,não-smartphone
10637493,Capa Samsung Galaxy S4 Tread Branco,não-smartphone
10637502,Capa Samsung Galaxy S3 I9300 Silicone Branco,não-smartphone
10637504,Capa Samsung Galaxy S4 Pc Robotic Mod 2 Silicone Branco,não-smartphone
10637505,Capa Lg L3 Ii Carteira De Couro Branco,não-smartphone
10637516,Capa Lg L5 Ii Pc Smile,não-smartphone
10637517,Bumper Motorola Moto G Rosa,não-smartphone
10637521,Capa Samsung Galaxy S4 TPU Duplo Branco e Preto,não-smartphone
10637530,Capa Motorola D1 TPU Vermelho,não-smartphone
10637532,Capa Samsung Galaxy S3 I9300 Pc Transparente,não-smartphone
10637536,Capa iPhone 3GS TPU Transparente,não-smartphone
10637539,Capa Samsung Galaxy Pocket Tpu Cinza,não-smartphone
10637542,Bumber Samsung Galaxy S4 Rosa Com Transparente,não-smartphone
10637544,Capa Samsung Galaxy Fame Duos Pc Rosa,não-smartphone
10637545,Capa Samsung Galaxy S4 Pc Smile,não-smartphone
10637548,Capa Samsung Galaxy SII Duos TV Ace 3 TPU Rosa,não-smartphone
10637557,Kit Capapelicula Samsung Galaxy Duos S6102 Preto,não-smartphone
10637558,Capa Samsung Galaxy Pocket TPU Amarelo,não-smartphone
10637564,Capa Samsung Galaxy S4 Ultra Slim Azul,não-smartphone
10637578,Capa Nokia Lumia 620 TPU Azul,não-smartphone
10637579,Capa Samsung Galaxy Grand Duos Tpu Vermelho,não-smartphone
10637580,Capa Samsung Galaxy Grand Duos PC Quatro Pontos Branco,não-smartphone
10637583,Capa Motorola Moto E Flip Cover Rosa,não-smartphone
10637586,Capa Flip Cover Samsung Galaxy Young Rosa,não-smartphone
10637589,Capa iPhone 4/4S Running Car Preto,não-smartphone
10637592,Capa Samsung Galaxy S4 Aluminio Rosa,não-smartphone
10637594,Bumber Motorola D1 Branco,não-smartphone
10637598,Capa Samsung Galaxy S6010 Tpu Music Preto,não-smartphone
10637604,Capa Iphone 4/4s Grid Slim Roxo,não-smartphone
10637611,Capa Samsug Galaxy S3 I9300 Couro Branco,não-smartphone
10637612,Bumber Samsung Galaxy Note 2 Rosa,não-smartphone
10637618,Capa Samsung Galaxy Grand Duos PC Branco,não-smartphone
10637621,Capa Flip Cover Samsung Galaxy S3 Mini Azul Marinho,não-smartphone
10637628,Capa Nokia 820 Pc Smile,não-smartphone
10637636,Capa Motorola Moto E Couro Colorida,não-smartphone
10637637,Capa Samsung Galaxy S4 PC Barcelona Rosa,não-smartphone
10637646,Capa Samsung Galaxy S6010 Tpu Music Rosa,não-smartphone
10637647,Kit Capa+Pelicula Nokia 630 TPU Transparente,não-smartphone
10637649,Capa Flip Cover Samsung Galaxy S4 Window Vermelho,não-smartphone
10637655,Capa Samsung Galaxy Ace S5830 Tpu Transparente,não-smartphone
10637658,Capa Iphone 4/4s Bbuble Marrom,não-smartphone
10637660,Capa Motorola Moto G Premium Vermelho,não-smartphone
10637664,Capa Motorola D1 TPU Azul,não-smartphone
10637669,Capa Flip Cover Samsung Galaxy S3 I9300 Preto,não-smartphone
10637671,Capa Flip Cover Samsung Galaxy S Duos Branco,não-smartphone
10637680,Capa Samsung Galaxy Grand Duos PC Robotic Silicone Preto,não-smartphone
10637686,Capa Samsung Galaxy S4 Aluminio Roxo,não-smartphone
10637693,Capa Nokia XL TPU Rosa,não-smartphone
10637705,Capa Samsung Galaxy S4 Pc Robotic Mod 1 Silicone Preto,não-smartphone
10637720,Kit Capapelicula Para Samsung Galaxy Y/Y Tv S5360 Preto,não-smartphone
10637723,Capa Samsung Galaxy Fame Duos Pc Branco,não-smartphone
10637725,Capa Motorola Moto E TPU Azul,não-smartphone
10637905,Bumper Samsung Galaxy Fame Preto/Transparente,não-smartphone
10637946,Capa Samsung Galaxy S3 Slim TPU Preto,não-smartphone
10637948,Capa Samsung Galaxy Grand Duos Flip Tpu Rosa,não-smartphone
10638186,Bumper Iphone 4/4s Metal Brilho Roxo,não-smartphone
10638187,Capa Samsung Galaxy S3 Duos/Galaxy Core Flip Azul,não-smartphone
10638191,Capa Iphone 4/4s Pc Colorida,não-smartphone
10638194,Bumper Samsung Galaxy S5 Vermelho,não-smartphone
10638201,Capa iPhone 6 Cabo Vermelho,não-smartphone
10638204,Capa Motorola D1 TPU Preto,não-smartphone
10638205,Capa Samsung Galaxy S4 Flip Rosa,não-smartphone
10638206,Capa Samsung Galaxy S Duos 2 S7582/S Duos Branco,não-smartphone
10638215,Capa Nokia 501 TPU Branco,não-smartphone
10638223,Capa Samsung S3 Duos TPU Branco,não-smartphone
10638226,Capa Samsung Galaxy S3 Mini PC Branco,não-smartphone
10638229,Capa Nokia X TPU Rosa,não-smartphone
10638232,Capa Lg L1 Tpu Verde,não-smartphone
10638236,Capa Samsung Tab 3 7 Flip Preto,não-smartphone
10638250,Capa Lg T375 Tpu Preto,não-smartphone
10638251,Capa Motorola Moto G Tpu Estrelas,não-smartphone
10638264,Capa Samsung Galaxy S Duos S7562 Rosa,não-smartphone
10638267,Bumper Samsung Galaxy Gran Duos Rosa,não-smartphone
10638271,Capa Samsung Galaxy S4 Vermelho,não-smartphone
10638273,Capa Lg L5 Ii Tpu Amarelo,não-smartphone
10638277,Capa Samsung Galaxy S4 PC+TPU Samsung Branco/Transparente,não-smartphone
10638280,Bumper Duplo Iphone 6 Preto/Vermelho,não-smartphone
10638284,Capa Nokia 520 TPU Gel Branco,não-smartphone
10638285,Capa Samsung Galaxy S3 Duos TPU Rosa,não-smartphone
10638296,Capa Motorola Moto G TPU Cinza,não-smartphone
10638299,Bumper Samsung Galaxy S3 Mini Branco/Transparente,não-smartphone
10638300,Capa Samsung Galaxy S4 Flip Branco,não-smartphone
10638304,Capa Nokia 625 TPU Preto,não-smartphone
10638321,Capa Samsung Galaxy Young Tpu Azul,não-smartphone
10638325,Capa Lg L5 Ii Tpu Roxo,não-smartphone
10638327,Capa Motorola Moto G Tpu Love Cartoon,não-smartphone
10638331,Capa Nokia 520 TPU Gel Preto,não-smartphone
10638333,Capa Samsung Galaxy Pocket Neo S5310 TPU Amarelo,não-smartphone
10638339,Capa Samsung Galaxy Young Tpu Rosa,não-smartphone
10638352,Capa Samsung Galaxy S4 Mini Verde,não-smartphone
10638353,Capa Samsung Galaxy Gran Duos Piano,não-smartphone
10638354,Capa Lg T375 Tpu Azul,não-smartphone
10638356,Capa Samsung Galaxy Win Duos Flip Azul,não-smartphone
10638363,Capa Samsung Galaxy Grand Duos Tpu Transparente,não-smartphone
10638385,Capa Samsung Galaxy S4 TPU+PC Rosa/Transparente,não-smartphone
10638393,Capa Iphone 5c Colorida Rosa,não-smartphone
10638394,Capa Samsung Galaxy Young Pc Smile,não-smartphone
10638398,Capa Nokia X TPU Preto,não-smartphone
10638432,Capa Motorola Moto G TPU Roxo,não-smartphone
